{
  "task_id": "queue-smoke-20260820T120612Z",
  "template": "patch",
  "request": "Create /tmp/jcode-rack-test/RACK_QUEUE_SMOKE.txt containing exactly RACK_QUEUE_OK. Then read the file and reply with exactly COMPLETE.",
  "max_attempts": 1,
  "timeout_seconds": 120,
  "steps": [
    {
      "name": "implement",
      "worker": "local-coder",
      "cwd": "/tmp/jcode-rack-test",
      "prompt": "Create /tmp/jcode-rack-test/RACK_QUEUE_SMOKE.txt containing exactly RACK_QUEUE_OK. Then read the file and reply with exactly COMPLETE.",
      "artifacts": [
        {
          "path": "/tmp/jcode-rack-test/RACK_QUEUE_SMOKE.txt",
          "exact_text": "RACK_QUEUE_OK"
        }
      ]
    }
  ]
}
